,Title,Datetime,Source,URL
1771,World Environment Day 2020: Young voices for climate justice,2020-06-05T15:10:16.846+0000,UNICEF Voices of Youth,https://www.voicesofyouth.org/blog/world-environment-day-2020-young-voices-climate-justice
1773,"New Research Shows Employee Trust Changing During COVID-19; Accuracy, Appropriate Frequency and Right Channels of Communication Correlate with Higher Levels of Trust",2020-05-12T00:52:19.666+0000,source,http://news.bismarcknewsupdates.com/story/242344/new-research-shows-employee-trust-changing-during-covid19-accuracy-appropriate-frequency-and-right-channels-of-communication-correlate-with-higher-levels-of-trust.html
1774,"New Research Shows Employee Trust Changing During COVID-19; Accuracy, Appropriate Frequency and Right Channels of Communication Correlate with Higher Levels of Trust",2020-05-11T14:34:21.650+0000,getnews.info/,http://www.getnews.info/1028918/new-research-shows-employee-trust-changing-during-covid19-accuracy-appropriate-frequency-and-right-channels-of-communication-correlate-with-higher-levels-of-trust.html
1775,"New Research Shows Employee Trust Changing During COVID-19; Accuracy, Appropriate Frequency and Right Channels of Communication Correlate with Higher Levels of Trust",2020-05-12T00:54:28.349+0000,source,http://news.augustaheadlines.com/story/242344/new-research-shows-employee-trust-changing-during-covid19-accuracy-appropriate-frequency-and-right-channels-of-communication-correlate-with-higher-levels-of-trust.html
1776,"New Research Shows Employee Trust Changing During COVID-19; Accuracy, Appropriate Frequency and Right Channels of Communication Correlate with Higher Levels of Trust",2020-05-12T01:23:55.224+0000,source,http://news.iowanewsheadlines.com/story/252393/new-research-shows-employee-trust-changing-during-covid19-accuracy-appropriate-frequency-and-right-channels-of-communication-correlate-with-higher-levels-of-trust.html
1778,"HC Closes Issues On Inadequate Testing, Internet",2020-04-30T01:19:07.601+0000,source,https://kashmirlife.net/hc-closes-issues-on-inadequate-testing-internet-231704/
1779,"3D Printing in Eyewear Market 2025: How Will the Disruptions Created by Covid19 Affect the Market? : Formlabs, Inc., Carbon, Inc., GlassesUSA.com, Fuel 3D Technologies Limited, Hoya Corporation, HoetOptiek NV, Materialise NV, & Luxottica Group SpA",2020-05-19T15:40:14.545+0000,SBWire,http://www.sbwire.com/press-releases/3d-printing-in-eyewear-market-2025-how-will-the-disruptions-created-by-covid19-affect-the-market-formlabs-inc-carbon-inc-glassesusacom-fuel-3d-technologies-limited-hoya-corporation-hoetoptiek-nv-materialise-nv-luxottica-group-spa-1291590.htm
1781,"Coronavirus vaccines and treatment are in development, but what is the world’s Plan C?",2020-04-26T04:05:04.813+0000,News.com.au,https://www.news.com.au/lifestyle/health/health-problems/coronavirus-vaccines-and-treatment-are-in-development-but-what-is-the-worlds-plan-c/news-story/082aa3bdda2ee957d532ec1e4605726c
1783,Scientists are racing to find the best drugs to treat COVID-19,2020-03-23T13:30:14.758+0000,The Verge Internet Services,https://www.theverge.com/2020/3/23/21188167/coronavirus-treatment-clinical-trials-drugs-remdesivir-chloroquine-covid
1915,"Mobile Health and Fitness Sensor Market with Coronavirus (Covid-19) Impact Analysis | also Industry is Booming Worldwide with Key Players | F. Hoffmann-La Roche, Bayer, Acute Technology, Qualcomm, OMRON, Fujitsu, LifeScan, Abbott Laboratories, GE Healthcare – 3w Market News Reports",2020-05-18T18:28:29.368+0000,source,https://3wnews.org/uncategorised/880894/mobile-health-and-fitness-sensor-market-with-coronavirus-covid-19-impact-analysis-also-industry-is-booming-worldwide-with-key-players-f-hoffmann-la-roche-bayer-acute-technology-qualcomm-omr/
1929,"Data Center Networking Market with Coronavirus (Covid-19) Impact Analysis | also Industry is Booming Worldwide with Key Players | Alcatel-Lucent, Brocade, Cisco, Dell, EMC, Extreme Networks, Equinix, Fujitsu, Hewlett Packard (Hp), Hitachi Data Systems, IBM",2020-05-25T15:21:20.282+0000,source,https://www.newsdistinct.com/data-center-networking-market-with-coronavirus-covid-19-impact-analysis-also-industry-is-booming-worldwide-with-key-players-alcatel-lucent-brocade-cisco-dell-emc-extreme-networks-equinix/
1955,"Mobile Health and Fitness Sensor Market with Coronavirus (Covid-19) Impact Analysis | also Industry is Booming Worldwide with Key Players | Honeywell, Bayer, Fujitsu, Abbott Laboratories, Acute Technology, F., Hoffmann-La Roche, Johnson & Johnson, GE Healthcare – Cole Reports",2020-04-22T16:43:31.154+0000,source,https://coleofduty.com/news/2020/04/22/mobile-health-and-fitness-sensor-market-with-coronavirus-covid-19-impact-analysis-also-industry-is-booming-worldwide-with-key-players-honeywell-bayer-fujitsu-abbott-laboratories-acute-techno/
1960,"Cyber Security Market with Coronavirus (Covid-19) Impact Analysis | Industry Trends, Innovation, Growth Opportunities, Demand, Application, Top Companies Analysis by 2020-2024 | Acuity Risk Management, PWC, Intruder, Protectimus, Assuria, Device Authority, Silobreaker, Sophos, SentryBay",2020-05-15T11:04:32.338+0000,source,https://coleofduty.com/military-news/2020/05/15/cyber-security-market-with-coronavirus-covid-19-impact-analysis-industry-trends-innovation-growth-opportunities-demand-application-top-companies-analysis-by-2020-2024-acuity-risk-management/
1977,"Artificial Intelligence Market Size | AI Industry Report, 2020-2025 | Covid-19 Impact Analysis | Anticipating a CAGR of 35.21% | BMRC",2020-06-08T17:57:14.661+0000,source,http://news.augustaheadlines.com/story/245798/artificial-intelligence-market-size-ai-industry-report-20202025-covid19-impact-analysis-anticipating-a-cagr-of-3521-bmrc.html
1982,"Artificial Intelligence Market Size | AI Industry Report, 2020-2025 | Covid-19 Impact Analysis | Anticipating a CAGR of 35.21% | BMRC",2020-06-08T14:02:27.876+0000,source,http://news.bismarcknewsupdates.com/story/245798/artificial-intelligence-market-size-ai-industry-report-20202025-covid19-impact-analysis-anticipating-a-cagr-of-3521-bmrc.html
2178,Covid-19 impact on Metal Coil Lamination Market Size | Industry Trends Report 2025 | CAGR of 4.86%,2020-05-14T04:23:46.326+0000,source,http://news.iowanewsheadlines.com/story/252816/covid19-impact-on-metal-coil-lamination-market-size-industry-trends-report-2025-cagr-of-486.html
2179,Covid-19 impact on Metal Coil Lamination Market Size | Industry Trends Report 2025 | CAGR of 4.86%,2020-05-14T02:51:49.031+0000,source,http://news.augustaheadlines.com/story/242750/covid19-impact-on-metal-coil-lamination-market-size-industry-trends-report-2025-cagr-of-486.html
2180,Covid-19 impact on Metal Coil Lamination Market Size | Industry Trends Report 2025 | CAGR of 4.86%,2020-05-14T03:09:20.896+0000,source,http://news.bismarcknewsupdates.com/story/242750/covid19-impact-on-metal-coil-lamination-market-size-industry-trends-report-2025-cagr-of-486.html
2284,You are waiting for the surge,2020-04-21T09:02:07.757+0000,statnews.com/,https://www.statnews.com/2020/04/21/you-are-waiting-for-the-surge/
2285,Sunburn — The morning read of what’s hot in Florida politics — 3.27.20,2020-03-27T10:05:42.678+0000,floridapolitics.com/,https://floridapolitics.com/archives/324820-sunburn-the-morning-read-of-whats-hot-in-florida-politics-3-27-20
2286,Sunburn — The morning read of what’s hot in Florida politics — 5.27.20,2020-05-27T08:03:31.333+0000,floridapolitics.com/,https://floridapolitics.com/archives/334995-sunburn-the-morning-read-of-whats-hot-in-florida-politics-5-27-20
2320,How COVID-19 Is Making Daily Life Challenging for Those with Autism,2020-04-23T00:21:08.929+0000,Healthline,https://www.healthline.com/health-news/how-covid19-is-affecting-daily-life-for-people-with-autism
2326,Mashup Team13 wins the Crack The COVID19 Crisis’ National Online Hackathon,2020-06-12T06:34:26.113+0000,source,https://www.crn.in/news/mashup-team13-wins-the-crack-the-covid19-crisis-national-online-hackathon/
2332,Italy’s Politicians Are Making the Coronavirus Crisis Worse,2020-03-09T19:14:38.615+0000,Foreign Policy,https://foreignpolicy.com/2020/03/09/italy-covid19-coronavirus-conte-salvini-epidemic-politicians-are-making-crisis-worse/
4627,China: The Army Retreats,2020-02-26T17:13:01.635+0000,StrategyPage.com,https://www.strategypage.com/qnd/china/articles/20200226.aspx
4634,Palantir’s NHS data project “may outlive coronavirus crisis”,2020-04-30T16:34:29.326+0000,New Statesman,https://tech.newstatesman.com/coronavirus/palantir-covid19-datastore-coronavirus
4679,"If you can stay home now, you make things safer for the people who can’t",2020-03-11T18:55:28.848+0000,Vox,https://www.vox.com/future-perfect/2020/3/11/21171903/coronavirus-social-distancing-pandemic-covid19
4681,"Malaria drugs' promise for coronavirus spurs hope, shortages",2020-03-23T22:46:35.584+0000,Boston.com,https://www.boston.com/news/health/2020/03/23/malaria-drugs-promise-for-coronavirus-spurs-hope-shortages
4687,[Weekly Funding Roundup] Startups raise $125M in the third week of March amid coronavirus threat,2020-03-21T01:20:20.488+0000,"Stories of Entrepreneurs, Innovators, Leaders, Founders and Changemakers",https://yourstory.com/2020/03/weekly-funding-startups-raise-125-million-coronavirus-covid19
4688,"Malaria drugs’ promise for coronavirus spurs hope, shortages",2020-03-23T20:49:36.197+0000,source,https://federalnewsnetwork.com/business-news/2020/03/malaria-drugs-promise-for-coronavirus-spurs-hope-shortages/
4690,"Lockdowns, remote education, and local innovation: What will post Corona life look like?",2020-05-11T22:25:12.776+0000,"Newtimes, Rwanda&#039;s Leading Daily",https://www.newtimes.co.rw/business/lockdowns-remote-education-and-local-innovation-what-will-post-corona-life-look
4694,Donald Trump reveals he has defied doctors' warnings by taking unproven drug hydroxychloroquine,2020-05-19T11:13:50.270+0000,The Daily Mail,https://www.dailymail.co.uk/news/article-8335501/Donald-Trump-reveals-defied-doctors-warnings-taking-unproven-drug-hydroxychloroquine.html?ns_mchannel=rss&ito=1490&ns_campaign=1490
4698,Evening Update Friday 15 May 2020,2020-05-15T14:33:50.290+0000,Riviera Radio,http://rivieraradio.mc/news/evening-update-friday-15-may-2020
4699,Donald Trump reveals he has defied doctors' warnings by taking unproven drug hydroxychloroquine,2020-05-19T10:43:02.600+0000,The Daily Mail,https://www.dailymail.co.uk/news/article-8335501/Donald-Trump-reveals-defied-doctors-warnings-taking-unproven-drug-hydroxychloroquine.html?ns_mchannel=rss&ns_campaign=1490&ito=1490
4700,Mike Pence says he is NOT on hydroxy - as mystery over who prescribed the drug to Trump deepens,2020-05-19T20:51:27.425+0000,The Daily Mail,https://www.dailymail.co.uk/news/article-8337159/Mike-Pence-says-NOT-hydroxy-mystery-prescribed-drug-Trump-deepens.html?ns_mchannel=rss&ns_campaign=1490&ito=1490
4702,Rescue package for temporary workers rolled out,2020-04-22T08:37:02.263+0000,News.com.au,https://www.news.com.au/national/tasmania/daily-blog-april-22-one-covid19-case-diagnosed-overnight/news-story/07b3c2b88a2c6ec40bc12960e71cc214
4704,Coronavirus (COVID-19) Insurance Policy Issues - Coronavirus (Covid-19) - Canada,2020-04-15T02:14:08.381+0000,Mondaq Business Briefing,http://www.mondaq.com/Article/917312
4711,Coronavirus: What's happening in Canada and the world Friday,2020-04-10T18:16:48.257+0000,Canadian Broadcasting Corporation,https://www.cbc.ca/news/canada/coronavirus-covid19-april10-canada-world-1.5529020
4712,"News Items – April 8, 2020",2020-04-08T15:57:54.282+0000,Social Workers Speak,http://www.socialworkersspeak.org/media/news-round-up/news-items-april-8-2020.html
4836,"President Trump addressed the nation on coronavirus. Here’s what Trump, Treasury Secretary Steve Mnuchin, Dr. Fauci, Dr. Birx said",2020-03-17T17:29:56.874+0000,source,https://www.deseret.com/u-s-world/2020/3/17/21183624/coronavirus-covid19-president-donald-trump-speech-today-steve-mnuchin-mike-pence
5244,Playing Through COVID19?,2020-04-03T01:34:36.822+0000,The Moderate Voice,https://themoderatevoice.com/playing-through-covid19/
5288,Death projections for state on decline,2020-04-07T08:59:57.002+0000,NWAOnline,https://www.nwaonline.com/news/2020/apr/07/death-projections-for-state-on-decline-/
5289,Death projections for state on decline,2020-04-07T09:08:33.591+0000,Arkansas Online,https://www.arkansasonline.com/news/2020/apr/07/death-projections-for-state-on-decline-/
5290,"Coronavirus latest updates: Trump may extend US travel ban, Australia warns disease may not peak for months",2020-03-14T02:10:54.553+0000,The Guardian,https://www.theguardian.com/world/live/2020/mar/14/coronavirus-live-updates-uk-us-australia-italy-europe-school-shutdown-sport-events-cancelled-latest-update-news
5298,"Covid 19 coronavirus: Donald Trump makes 'Noble' bungle, slams report about his 'work schedule and eating habits'",2020-04-27T05:10:52.996+0000,New Zealand Herald,https://www.nzherald.co.nz/world/news/article.cfm?c_id=2&objectid=12327790
5301,"New Innovative Research on Electrostatic Eliminator Market by demanding Key Players like KEYENCE, SMC, Panasonic – 3",2020-05-24T20:37:56.450+0000,source,https://3wnews.org/uncategorised/942675/new-innovative-research-on-electrostatic-eliminator-market-by-demanding-key-players-like-keyence-smc-panasonic/
5306,FDA authorizes experimental drug remdesivir for emergency use in COVID-19 patients,2020-05-01T20:14:09.400+0000,The Verge Internet Services,https://www.theverge.com/2020/5/1/21241612/remdesivir-fda-emergency-authorization-treatment-covid-19-coronavirus-fauci
5309,Coronavirus: What's happening in Canada and around the world Friday,2020-04-17T23:33:40.339+0000,Canadian Broadcasting Corporation,https://www.cbc.ca/news/canada/coronavirus-covid19-april17-canada-world-1.5535549
5314,This is what is will take for the US to solve its testing problem and actually get everyone back to work safely,2020-05-12T14:56:18.145+0000,uk.businessinsider.com/,https://www.businessinsider.com/coronavirus-reopening-testing-plan-covid19-antibody-pcr-problems-solutions-2020-4?r=DE&IR=T
5316,This is what is will take for the US to solve its testing problem and actually get everyone back to work safely,2020-05-12T15:21:36.609+0000,businessinsider.sg/,https://www.businessinsider.sg/coronavirus-reopening-testing-plan-covid19-antibody-pcr-problems-solutions-2020-4
5317,Reshaping health care in the aftermath of Covid-19 - STAT,2020-04-23T09:01:43.572+0000,statnews.com/,https://www.statnews.com/2020/04/23/covid-19-aftermath-no-return-to-business-as-usual/
5320,How to volunteer and donate in New Jersey during the coronavirus outbreak (06/04/20),2020-06-05T03:23:01.213+0000,New Jersey Online,https://www.nj.com/coronavirus/2020/06/how-to-volunteer-and-donate-in-new-jersey-during-the-coronavirus-outbreak-060420.html
5321,How to volunteer and donate in New Jersey during the coronavirus outbreak (06/07/20),2020-06-08T00:12:25.590+0000,New Jersey Online,https://www.nj.com/coronavirus/2020/06/how-to-volunteer-and-donate-in-new-jersey-during-the-coronavirus-outbreak-060720.html
5479,Transport chief explains emergency plan,2020-05-15T16:01:49.656+0000,Express & Star,https://www.expressandstar.com/news/health/coronavirus-covid19/2020/05/15/transport-chief-explains-emergency-plan/
5521,How to volunteer and donate in New Jersey during the coronavirus outbreak (06/14/20),2020-06-15T00:23:16.151+0000,New Jersey Online,https://www.nj.com/coronavirus/2020/06/how-to-volunteer-and-donate-in-new-jersey-during-the-coronavirus-outbreak-061420.html
6244,Hand hygiene message from Shropshire health bosses,2020-05-01T08:56:57.224+0000,Shropshire Star,https://www.shropshirestar.com/news/health/coronavirus-covid19/2020/05/01/hand-hygiene-message-from-shropshire-health-bosses/
6249,"White House, tech industry meet to discuss coronavirus response",2020-03-11T19:57:46.589+0000,iTnews,https://www.itnews.com.au/news/white-house-tech-industry-meet-to-discuss-coronavirus-response-539200
6255,Why coronavirus is ruining your sleep,2020-04-15T01:15:17.995+0000,News.com.au,https://www.news.com.au/lifestyle/health/health-problems/coronavirus-australia-why-covid19-is-ruining-your-sleep/news-story/e0d05d9b32a41cabb6ee381ed1c254d4
6265,"Pandemics, Plans, Perceptions (in Water).",2020-05-13T17:37:25.676+0000,source,https://energycentral.com/c/um/pandemics-plans-perceptions-water
6302,Global Medication Dispensing and Packaging Systems Market to Grow Alongside Advancements in Medical Delivery Practices - Transparency Market Research,2020-06-15T09:41:59.407+0000,Finanzen.net GmbH,https://www.finanzen.ch/nachrichten/aktien/global-medication-dispensing-and-packaging-systems-market-to-grow-alongside-advancements-in-medical-delivery-practices-transparency-market-research-1029307269
6303,Global Medication Dispensing and Packaging Systems Market to Grow Alongside Advancements in Medical Delivery Practices - Transparency Market Research,2020-06-15T09:44:07.482+0000,"FinanzNachrichten.de - Alle Nachrichten zu Aktien, Börse und Wirtschaft!!",https://www.finanznachrichten.de/nachrichten-2020-06/49919458-global-medication-dispensing-and-packaging-systems-market-to-grow-alongside-advancements-in-medical-delivery-practices-transparency-market-research-008.htm
6304,Coronavirus parenting: Protecting your children during the pandemic,2020-06-02T05:52:19.809+0000,San Francisco Bay View,https://sfbayview.com/2020/06/coronavirus-parenting-protecting-your-children-during-the-pandemic/
6305,Global PET Preform Machine Market to Expand as Governments Ramp up Investments in Medical Research - Transparency Market Research,2020-05-27T11:07:45.669+0000,"FinanzNachrichten.de - Alle Nachrichten zu Aktien, Börse und Wirtschaft!!",https://www.finanznachrichten.de/nachrichten-2020-05/49764531-global-pet-preform-machine-market-to-expand-as-governments-ramp-up-investments-in-medical-research-transparency-market-research-008.htm
6306,OneDigital : Delivers Cutting-Edge COVID-19 Health Plan Cost Impact Tool,2020-04-06T04:30:36.202+0000,source,https://www.marketscreener.com/news/OneDigital-Delivers-Cutting-Edge-COVID-19-Health-Plan-Cost-Impact-Tool--30317247/
6307,"Demand for High Speed Connectivity for Industries in Asia Pacific Makes it Lucrative Region, Global Valuation of Fiber Optic Cables Market to Reach ~US$ 15 Bn by 2030 - TMR",2020-06-09T16:57:31.621+0000,Finanzen.net GmbH,https://www.finanzen.ch/nachrichten/aktien/demand-for-high-speed-connectivity-for-industries-in-asia-pacific-makes-it-lucrative-region-global-valuation-of-fiber-optic-cables-market-to-reach-~us$-15-bn-by-2030-tmr-1029293956
6309,"Demand for High Speed Connectivity for Industries in Asia Pacific Makes it Lucrative Region, Global Valuation of Fiber Optic Cables Market to Reach ~US$ 15 Bn by 2030 - TMR",2020-06-09T16:43:51.758+0000,"FinanzNachrichten.de - Alle Nachrichten zu Aktien, Börse und Wirtschaft!!",https://www.finanznachrichten.de/nachrichten-2020-06/49876754-demand-for-high-speed-connectivity-for-industries-in-asia-pacific-makes-it-lucrative-region-global-valuation-of-fiber-optic-cables-market-to-reach-u-008.htm
6316,Elsevier Launches Veridata Electronic Data Capture (EDC) and Offers Free Access to Help Researchers Studying COVID-19,2020-03-26T14:53:50.972+0000,"FinanzNachrichten.de - Alle Nachrichten zu Aktien, Börse und Wirtschaft!!",https://www.finanznachrichten.de/nachrichten-2020-03/49218283-elsevier-launches-veridata-electronic-data-capture-edc-and-offers-free-access-to-help-researchers-studying-covid-19-008.htm
6317,Global Medication Dispensing and Packaging Systems Market to Grow Alongside Advancements in Medical Delivery Practices - Transparency Market Research,2020-06-15T09:41:55.714+0000,Finanzen.net GmbH,https://www.finanzen.ch/nachrichten/aktien/global-medication-dispensing-and-packaging-systems-market-to-grow-alongside-advancements-in-medical-delivery-practices-transparency-market-research-1029307268
6318,Coronavirus: What are the latest free cyber security offers?,2020-03-26T16:37:09.583+0000,ComputerWeekly.com,https://www.computerweekly.com/news/252480677/Coronavirus-What-are-the-latest-free-cyber-security-offers
6320,Xtalks Announces Its Life Science Webinar Calendar for May 2020,2020-05-01T22:42:45.812+0000,source,https://www.prweb.com/releases/xtalks_announces_its_life_science_webinar_calendar_for_may_2020/prweb17091499.htm
6321,The Frightening Economy On 'The Other Side' Of COVID-19,2020-04-11T12:46:50.581+0000,staticseekingalpha.a.ssl.fastly.net/,https://seekingalpha.com/article/4337041-frightening-economy-on-the-side-of-covidminus-19
6324,New data shows rate of new COVID-19 cases slowing in Chicago,2020-04-16T01:49:42.963+0000,Private Registration,https://chicagodefender.com/new-data-shows-rate-of-new-covid-19-cases-slowing-in-chicago/
6328,Liberia: World Bank Report Sees 'Serious Weaknesses' in 'Unprepared' COVID19 Response,2020-04-26T10:33:00.139+0000,allAfrica.com,https://allafrica.com/stories/202004260034.html
6331,How to volunteer and donate in New Jersey during the coronavirus outbreak (04/20/20),2020-04-21T02:11:54.752+0000,New Jersey Online,https://www.nj.com/coronavirus/2020/04/how-to-volunteer-and-donate-in-new-jersey-during-the-coronavirus-outbreak-042020.html
6334,How to volunteer and donate in New Jersey during the coronavirus outbreak (04/16/20),2020-04-17T06:12:04.580+0000,New Jersey Online,https://www.nj.com/coronavirus/2020/04/how-to-volunteer-and-donate-in-new-jersey-during-the-coronavirus-outbreak-041620.html
6337,"David Beckham. Rita Ora, Liam Payne and Ellie Goulding lead UK stars in Global Citizen concert",2020-04-19T01:39:23.498+0000,The Daily Mail,https://www.dailymail.co.uk/tvshowbiz/article-8233003/Niall-Horan-leads-British-stars-Global-Citizen-One-World-Home.html?ns_mchannel=rss&ns_campaign=1490&ito=1490
6338,"David Beckham. Rita Ora, Liam Payne and Ellie Goulding lead UK stars in Global Citizen concert",2020-04-19T00:51:36.743+0000,The Daily Mail,https://www.dailymail.co.uk/tvshowbiz/article-8233003/Niall-Horan-leads-British-stars-Global-Citizen-One-World-Home.html?ns_mchannel=rss&ito=1490&ns_campaign=1490
6732,Why we need a COVID-19 Plan C,2020-04-26T03:59:02.072+0000,The Courier-Mail,https://www.couriermail.com.au/lifestyle/health/coronavirus-vaccines-and-treatment-are-in-development-but-what-is-the-worlds-plan-c/news-story/082aa3bdda2ee957d532ec1e4605726c
